{
  "$schema": "../../.schemas/icon.schema.json",
  "name": "customer-service-ai",
  "aliases": [
    "support-ai",
    "ai-help"
  ],
  "tags": [
    "artificial-intelligence",
    "help",
    "assistance"
  ],
  "categories": [
    "business",
    "technology"
  ],
  "contributors": [
    "dot-alter"
  ]
}