{
  "$schema": "../../.schemas/icon.schema.json",
  "name": "git-commit-lateral",
  "aliases": [
    "version-control-commit-l"
  ],
  "tags": [
    "version-control",
    "development",
    "code"
  ],
  "categories": [
    "development",
    "programming"
  ],
  "contributors": [
    "dot-alter"
  ]
}